{
  "format": "lnclass.course-sheet",
  "version": 1,
  "course": "proprietes-de-thales-dans-un-triangle",
  "theme": "blue",
  "pages": [
    {
      "header": {
        "eyebrow_left": "Mathématiques — Classe de 3e",
        "eyebrow_right": "Géométrie · Fiche de cours",
        "title": "La propriété de Thalès",
        "intro": "Elle permet de calculer des longueurs dans deux triangles formés par deux droites [[secantes|sécantes]] et deux droites [[paralleles|parallèles]]."
      },
      "sections": [
        {
          "title": "L'énoncé",
          "blocks": [
            {
              "type": "box",
              "tone": "property",
              "label": "Propriété de Thalès",
              "paragraphs": [
                "Soient (d) et (d′) deux droites [[secantes|sécantes]] en **A**. **B** et **M** sont deux points de (d), **C** et **N** sont deux points de (d′), [[distincts|distincts]] de A.",
                "Si les droites **(BC)** et **(MN)** sont [[paralleles|parallèles]], alors :",
                "$$\\frac{AM}{AB} = \\frac{AN}{AC} = \\frac{MN}{BC}$$",
                "*Autrement dit, les longueurs des côtés du triangle AMN sont [[proportionnelles|proportionnelles]] à celles du triangle ABC.*"
              ]
            },
            {
              "type": "simple",
              "text": "Le petit triangle AMN a la même forme que le grand triangle ABC : c'est une copie plus petite (ou plus grande). Pour passer d'une longueur du grand à la longueur correspondante du petit, on multiplie toujours par le même nombre. Par exemple, si AM est la moitié de AB, alors AN est la moitié de AC et MN est la moitié de BC."
            }
          ]
        },
        {
          "title": "Les deux configurations",
          "blocks": [
            {
              "type": "paragraph",
              "text": "Figure interactive : déplace les points A, B, C, M et N. Fais passer M de l'autre côté de A pour obtenir la configuration papillon."
            },
            {
              "type": "media",
              "kind": "thales_figure",
              "params": {
                "a_x": 70,
                "a_y": 165,
                "b_x": 360,
                "b_y": 55,
                "c_x": 345,
                "c_y": 285,
                "k_m": 0.45,
                "k_n": 0.45
              }
            },
            {
              "type": "table",
              "headers": [
                "Configuration triangle",
                "Configuration papillon"
              ],
              "rows": [
                [
                  "M est sur la [[demidroite|demi-droite]] [AB) et N sur la demi-droite [AC). Les triangles AMN et ABC sont emboîtés : l'un est une [[reduction|réduction]] ou un [[agrandissement|agrandissement]] de l'autre.",
                  "A est entre M et B, et entre N et C. Les triangles AMN et ABC sont [[opposes|opposés par le sommet]] A. Les mêmes égalités s'appliquent."
                ]
              ]
            },
            {
              "type": "simple",
              "text": "Dans les deux cas, il y a deux triangles qui se touchent au point A. Triangle : le petit est rangé dans le grand. Papillon : les deux triangles sont de part et d'autre de A, comme les deux ailes d'un papillon. On écrit exactement la même égalité."
            }
          ]
        },
        {
          "title": "Méthode : calculer une longueur",
          "blocks": [
            {
              "type": "steps",
              "label": "Rédaction type",
              "items": [
                "Je décris la figure : « Les droites (BM) et (CN) sont sécantes en A. »",
                "Je cite l'[[hypothese|hypothèse]] : « Les droites (MN) et (BC) sont parallèles. »",
                "J'écris les égalités : « D'après la propriété de Thalès, AM/AB = AN/AC = MN/BC. »",
                "Je remplace par les longueurs connues et je choisis les deux [[rapport|rapports]] utiles.",
                "Je calcule avec le [[croix|produit en croix]], puis je conclus avec l'unité."
              ]
            },
            {
              "type": "simple",
              "text": "On dit ce qu'on voit sur la figure, on rappelle que les droites sont parallèles, on écrit les trois fractions, on garde les deux fractions qui contiennent la longueur cherchée et des nombres connus, puis on calcule."
            },
            {
              "type": "box",
              "tone": "method",
              "label": "Exemple rédigé",
              "paragraphs": [
                "Les droites (BM) et (CN) sont sécantes en A et les droites (MN) et (BC) sont parallèles. On donne AM = 3 cm, AB = 5 cm, AC = 7 cm et BC = 6 cm. **Calculer AN et MN.**",
                "Les droites (BM) et (CN) sont sécantes en A et (MN) // (BC).",
                "D'après la propriété de Thalès : $\\frac{AM}{AB} = \\frac{AN}{AC} = \\frac{MN}{BC}$ soit $\\frac{3}{5} = \\frac{AN}{7} = \\frac{MN}{6}$",
                "AN = 3 × 7 ÷ 5 = 21 ÷ 5 = 4,2 → **AN = 4,2 cm**",
                "MN = 3 × 6 ÷ 5 = 18 ÷ 5 = 3,6 → **MN = 3,6 cm**"
              ]
            }
          ]
        }
      ]
    },
    {
      "sections": [
        {
          "title": "La [[reciproque|réciproque]] : prouver un parallélisme",
          "blocks": [
            {
              "type": "box",
              "tone": "remember",
              "label": "Réciproque de Thalès",
              "paragraphs": [
                "Soient (d) et (d′) deux droites sécantes en A. B et M sont deux points de (d), C et N deux points de (d′), distincts de A.",
                "Si **AM/AB = AN/AC** et si les points A, M, B et les points A, N, C sont **[[alignes|alignés dans le même ordre]]**, alors les droites **(MN) et (BC) sont parallèles**.",
                "**Attention :** on calcule les deux rapports séparément avant de les comparer. Le rapport MN/BC ne sert pas ici.",
                "Ex. : AM = 4, AB = 10, AN = 6, AC = 15. AM/AB = 4 ÷ 10 = 0,4 et AN/AC = 6 ÷ 15 = 0,4. Les rapports sont égaux et les points sont dans le même ordre, donc (MN) // (BC)."
              ]
            },
            {
              "type": "simple",
              "text": "La réciproque fait le chemin inverse. Cette fois, on ne sait pas si les droites sont parallèles : on veut le découvrir. On calcule les deux fractions. Si elles donnent le même nombre et que les points sont rangés dans le même ordre, les droites sont parallèles."
            }
          ]
        },
        {
          "title": "La [[contraposee|contraposée]] : prouver un non-parallélisme",
          "blocks": [
            {
              "type": "box",
              "tone": "property",
              "label": "Contraposée de Thalès",
              "paragraphs": [
                "Avec les mêmes notations, si **AM/AB ≠ AN/AC**, alors les droites **(MN) et (BC) ne sont pas parallèles**.",
                "Ex. : AM = 3, AB = 8, AN = 4, AC = 10. AM/AB = 3 ÷ 8 = 0,375 et AN/AC = 4 ÷ 10 = 0,4. Comme 0,375 ≠ 0,4, (MN) et (BC) ne sont pas parallèles.",
                "Sur la figure de la page 1, clique sur « Libérer N » pour tester la réciproque et la contraposée."
              ]
            },
            {
              "type": "simple",
              "text": "Si les deux fractions ne donnent pas le même nombre, c'est fini : les droites ne peuvent pas être parallèles."
            },
            {
              "type": "table",
              "caption": "Quelle propriété utiliser ?",
              "headers": [
                "Situation",
                "Propriété à utiliser"
              ],
              "rows": [
                [
                  "Je sais que les droites sont parallèles, je cherche une **longueur**",
                  "→ Propriété de Thalès"
                ],
                [
                  "Je veux montrer que deux droites **sont parallèles**",
                  "→ Réciproque"
                ],
                [
                  "Je veux montrer que deux droites **ne sont pas parallèles**",
                  "→ Contraposée"
                ]
              ]
            }
          ]
        },
        {
          "title": "Exercices d'application",
          "blocks": [
            {
              "type": "exercise",
              "title": "Exercice 1 · Triangle",
              "prompt": "(BM) et (CN) sont sécantes en A, M ∈ [AB], N ∈ [AC] et (MN) // (BC). AM = 4 cm, AB = 10 cm, AC = 12 cm, BC = 8 cm. Calculer AN et MN.",
              "fields": [
                {
                  "id": "e1an",
                  "input": "numeric",
                  "label": "AN (cm) =",
                  "answer": 4.8
                },
                {
                  "id": "e1mn",
                  "input": "numeric",
                  "label": "MN (cm) =",
                  "answer": 3.2
                }
              ],
              "correction": "D'après Thalès : 4/10 = AN/12 = MN/8.\nAN = 4 × 12 ÷ 10 = **4,8 cm**\nMN = 4 × 8 ÷ 10 = **3,2 cm**"
            },
            {
              "type": "exercise",
              "title": "Exercice 2 · Papillon",
              "prompt": "(BM) et (CN) sont sécantes en A, A est entre B et M et entre C et N, (MN) // (BC). AB = 6 cm, AC = 9 cm, AM = 4 cm, MN = 5 cm. Calculer AN et BC.",
              "fields": [
                {
                  "id": "e2an",
                  "input": "numeric",
                  "label": "AN (cm) =",
                  "answer": 6
                },
                {
                  "id": "e2bc",
                  "input": "numeric",
                  "label": "BC (cm) =",
                  "answer": 7.5
                }
              ],
              "correction": "D'après Thalès : 4/6 = AN/9 = 5/BC.\nAN = 4 × 9 ÷ 6 = **6 cm**\nBC = 5 × 6 ÷ 4 = **7,5 cm**"
            },
            {
              "type": "exercise",
              "title": "Exercice 3 · Parallèles ?",